{
  "diensttag": "2026-10-01",
  "art": "unterschrift_nachgeholt",
  "text": "Unterschrift von Chris nachgeholt.",
  "von": "Chris",
  "um": "2026-10-02T18:55:00+02:00",
  "unterschrift": "Unterschriften/Betreuung-2_Chris.png",
  "_meta": {
    "schema": "nachtrag/1",
    "angelegt_um": "2026-10-02T18:55:00+02:00",
    "angelegt_von": "Chris",
    "geraet": "tablet-st-pius",
    "unveraenderlich": true
  }
}
